{
  "$schema": "https://json-schema.org/draft/2020-12/schema",
  "title": "Vicekrack Story Brief",
  "description": "Subject-neutral input to the Creator stage, version 1.0: the topic, angle, sources and the only claims a script may state.",
  "type": "object",
  "additionalProperties": false,
  "required": [
    "contract",
    "version",
    "brief_id",
    "content_profile",
    "format",
    "language",
    "topic",
    "angle",
    "sources",
    "claims",
    "constraints",
    "provenance"
  ],
  "properties": {
    "contract": { "const": "story_brief" },
    "version": { "const": "1.0" },
    "brief_id": { "$ref": "#/$defs/identifier", "maxLength": 100 },
    "parent_task_id": { "$ref": "#/$defs/identifier" },
    "content_profile": { "$ref": "#/$defs/identifier" },
    "format": { "enum": ["vertical_short_15s"] },
    "language": { "type": "string", "pattern": "^[a-z]{2,3}(-[A-Z]{2})?$" },
    "topic": { "$ref": "#/$defs/text", "maxLength": 200 },
    "angle": { "$ref": "#/$defs/text", "maxLength": 200 },
    "sources": {
      "type": "array",
      "minItems": 1,
      "maxItems": 20,
      "items": { "$ref": "#/$defs/source" }
    },
    "claims": {
      "type": "array",
      "minItems": 1,
      "maxItems": 8,
      "items": { "$ref": "#/$defs/claim" }
    },
    "constraints": {
      "type": "object",
      "additionalProperties": false,
      "required": ["avoid", "disclosures", "tone"],
      "properties": {
        "avoid": {
          "type": "array",
          "maxItems": 5,
          "items": { "$ref": "#/$defs/text", "maxLength": 100 }
        },
        "disclosures": {
          "type": "array",
          "maxItems": 4,
          "items": { "$ref": "#/$defs/text", "maxLength": 120 }
        },
        "tone": { "type": ["string", "null"], "maxLength": 60 }
      }
    },
    "provenance": {
      "type": "object",
      "additionalProperties": false,
      "required": ["created_by", "provider", "model", "created_at"],
      "properties": {
        "created_by": { "$ref": "#/$defs/identifier" },
        "provider": { "enum": ["mock", "openai", "anthropic", "human", "local"] },
        "model": { "type": ["string", "null"], "maxLength": 100 },
        "created_at": { "$ref": "#/$defs/timestamp" }
      }
    },
    "verification": {
      "description": "Optional (Step 17). Links each claim to the Verification Record that decided it. When present, claim statuses must agree with it.",
      "type": "object",
      "additionalProperties": false,
      "required": ["policy_sha256", "record_ids", "claims"],
      "properties": {
        "policy_sha256": { "type": "string", "pattern": "^[0-9a-f]{64}$" },
        "record_ids": {
          "type": "array", "minItems": 1, "maxItems": 8, "uniqueItems": true,
          "items": { "type": "string", "pattern": "^ver-[0-9a-f]{24}$" }
        },
        "claims": {
          "type": "array", "minItems": 1, "maxItems": 8,
          "items": {
            "type": "object",
            "additionalProperties": false,
            "required": ["claim_id", "record_id", "record_claim_id", "verification_status"],
            "properties": {
              "claim_id": { "$ref": "#/$defs/identifier" },
              "record_id": { "type": "string", "pattern": "^ver-[0-9a-f]{24}$" },
              "record_claim_id": { "enum": ["k1", "k2", "k3"] },
              "verification_status": { "enum": ["verified", "corroborated", "insufficient_evidence"], "description": "insufficient_evidence only in a Step 49 rumor-lane brief (single report)." }
            }
          }
        }
      }
    },
    "editorial": {
      "description": "Optional (Step 18). Why Story Selection chose this story. Requires the verification block.",
      "type": "object",
      "additionalProperties": false,
      "required": ["selection_id", "selection_run_id", "record_id", "editorial_profile_sha256", "score", "topics", "novelty", "reasons"],
      "properties": {
        "selection_id": { "type": "string", "pattern": "^pick-[0-9a-f]{24}$" },
        "selection_run_id": { "type": "string", "pattern": "^sel-[0-9a-f]{24}$" },
        "record_id": { "type": "string", "pattern": "^ver-[0-9a-f]{24}$" },
        "editorial_profile_sha256": { "type": "string", "pattern": "^[0-9a-f]{64}$" },
        "score": { "type": "integer", "minimum": 0, "maximum": 100 },
        "topics": { "type": "array", "maxItems": 20, "items": { "$ref": "#/$defs/identifier" } },
        "novelty": { "enum": ["new", "update"] },
        "reasons": { "type": "array", "minItems": 1, "maxItems": 20, "uniqueItems": true,
                     "items": { "type": "string", "pattern": "^[a-z_]+$", "maxLength": 40 } },
        "lane": { "enum": ["rumor"], "description": "Step 49: present only for a rumor-lane selection. Its claims are all unverified." },
        "rumor_label": { "enum": ["multiple_reports", "single_report"], "description": "Step 49: required with lane." }
      },
      "dependentRequired": { "lane": ["rumor_label"], "rumor_label": ["lane"] }
    }
  },
  "$defs": {
    "identifier": { "type": "string", "pattern": "^[a-z0-9][a-z0-9_-]*$", "maxLength": 128 },
    "timestamp": {
      "type": "string",
      "pattern": "^[0-9]{4}-(0[1-9]|1[0-2])-(0[1-9]|[12][0-9]|3[01])T([01][0-9]|2[0-3]):[0-5][0-9]:[0-5][0-9](\\.[0-9]+)?Z$"
    },
    "text": { "type": "string", "minLength": 1, "pattern": "\\S" },
    "source": {
      "type": "object",
      "additionalProperties": false,
      "required": ["source_id", "title", "publisher", "kind"],
      "properties": {
        "source_id": { "$ref": "#/$defs/identifier" },
        "title": { "$ref": "#/$defs/text", "maxLength": 200 },
        "publisher": { "$ref": "#/$defs/text", "maxLength": 100 },
        "kind": { "enum": ["official", "press", "community", "other"] },
        "url": { "type": "string", "maxLength": 2048 },
        "accessed_at": { "$ref": "#/$defs/timestamp" }
      }
    },
    "claim": {
      "type": "object",
      "additionalProperties": false,
      "required": ["claim_id", "text", "status", "source_ids"],
      "properties": {
        "claim_id": { "$ref": "#/$defs/identifier" },
        "text": { "$ref": "#/$defs/text", "maxLength": 300 },
        "status": { "enum": ["verified", "unverified"] },
        "source_ids": {
          "type": "array",
          "maxItems": 10,
          "uniqueItems": true,
          "items": { "$ref": "#/$defs/identifier" }
        }
      }
    }
  }
}
